{
  "rule": "OBI-D-01",
  "section": "10.2",
  "description": "Is valid UTF-8 encoded JSON per RFC 8259. Duplicate JSON object keys within any object make the document non-conformant. A leading byte-order mark makes the document non-conformant. Note: RFC 8259 section 8.1 forbids adding a byte-order mark, and tolerating one would let two parsers disagree over the same bytes. Rejecting duplicate names follows interoperable-JSON practice (RFC 7493 section 2.3); most JSON parsers silently keep one duplicate value, so checking the duplicate clause requires a duplicate-detecting parse.",
  "notes": "Inline documents cover ordinary parsed values; documentText preserves duplicate keys and malformed JSON; documentBase64 carries exact bytes for invalid UTF-8 and a forbidden leading byte-order mark. Runners must hand the selected carriage to the strict document parser without pre-normalizing it.",
  "tests": [
    {
      "description": "minimal valid OBI document",
      "document": {
        "openbindings": "0.2.0",
        "operations": {}
      },
      "valid": true
    },
    {
      "description": "OBI document exercising several JSON value types",
      "document": {
        "openbindings": "0.2.0",
        "name": "Mixed types",
        "operations": {
          "createTask": {
            "deprecated": true,
            "tags": [
              "a",
              "b",
              "c"
            ],
            "input": {
              "type": "object"
            }
          }
        }
      },
      "valid": true
    },
    {
      "description": "duplicate root object key is invalid even when both values are individually valid",
      "documentText": "{\"openbindings\":\"0.2.0\",\"operations\":{},\"operations\":{}}",
      "valid": false,
      "violates": [
        "OBI-D-01"
      ],
      "notViolated": [
        "OBI-D-02",
        "OBI-D-03",
        "OBI-D-04",
        "OBI-D-05",
        "OBI-D-06",
        "OBI-D-07",
        "OBI-D-08",
        "OBI-D-09",
        "OBI-D-10",
        "OBI-D-11",
        "OBI-D-12",
        "OBI-D-13"
      ]
    },
    {
      "description": "duplicate key nested inside an operation object is invalid",
      "documentText": "{\"openbindings\":\"0.2.0\",\"operations\":{\"op\":{\"description\":\"a\",\"description\":\"b\"}}}",
      "valid": false,
      "violates": [
        "OBI-D-01"
      ],
      "notViolated": [
        "OBI-D-02",
        "OBI-D-03",
        "OBI-D-04",
        "OBI-D-05",
        "OBI-D-06",
        "OBI-D-07",
        "OBI-D-08",
        "OBI-D-09",
        "OBI-D-10",
        "OBI-D-11",
        "OBI-D-12",
        "OBI-D-13"
      ]
    },
    {
      "description": "leading UTF-8 byte-order mark is forbidden",
      "documentBase64": "77u/eyJvcGVuYmluZGluZ3MiOiIwLjIuMCIsIm9wZXJhdGlvbnMiOnt9fQ==",
      "valid": false,
      "violates": [
        "OBI-D-01"
      ],
      "notViolated": [
        "OBI-D-02",
        "OBI-D-03",
        "OBI-D-04",
        "OBI-D-05",
        "OBI-D-06",
        "OBI-D-07",
        "OBI-D-08",
        "OBI-D-09",
        "OBI-D-10",
        "OBI-D-11",
        "OBI-D-12",
        "OBI-D-13"
      ]
    },
    {
      "description": "invalid UTF-8 byte sequence is refused before JSON interpretation",
      "documentBase64": "/w==",
      "valid": false,
      "violates": [
        "OBI-D-01"
      ],
      "notViolated": [
        "OBI-D-02",
        "OBI-D-03",
        "OBI-D-04",
        "OBI-D-05",
        "OBI-D-06",
        "OBI-D-07",
        "OBI-D-08",
        "OBI-D-09",
        "OBI-D-10",
        "OBI-D-11",
        "OBI-D-12",
        "OBI-D-13"
      ]
    },
    {
      "description": "malformed JSON text is invalid",
      "documentText": "{\"openbindings\":\"0.2.0\",\"operations\":{}",
      "valid": false,
      "violates": [
        "OBI-D-01"
      ],
      "notViolated": [
        "OBI-D-02",
        "OBI-D-03",
        "OBI-D-04",
        "OBI-D-05",
        "OBI-D-06",
        "OBI-D-07",
        "OBI-D-08",
        "OBI-D-09",
        "OBI-D-10",
        "OBI-D-11",
        "OBI-D-12",
        "OBI-D-13"
      ]
    },
    {
      "description": "a leading byte-order mark makes the text non-conformant through OBI-D-01 alone: OBI-D-02 to OBI-D-13 impose no further requirement on it and hold vacuously (a tool records them as satisfied or not applicable), so the dependency on a missing operation adds no violation (section 10, The document and its data)",
      "documentBase64": "77u/eyJvcGVuYmluZGluZ3MiOiIwLjIuMCIsIm9wZXJhdGlvbnMiOnt9LCJkZXBlbmRlbmNpZXMiOnsiZCI6eyJvcGVyYXRpb24iOiJtaXNzaW5nIn19fQ==",
      "valid": false,
      "violates": [
        "OBI-D-01"
      ],
      "notViolated": [
        "OBI-D-02",
        "OBI-D-03",
        "OBI-D-04",
        "OBI-D-05",
        "OBI-D-06",
        "OBI-D-07",
        "OBI-D-08",
        "OBI-D-09",
        "OBI-D-10",
        "OBI-D-11",
        "OBI-D-12",
        "OBI-D-13"
      ]
    },
    {
      "description": "a repeated operations member makes the text non-conformant through OBI-D-01 alone, whichever value a parser keeps: OBI-D-02 to OBI-D-13 impose no further requirement on it and hold vacuously (a tool records them as satisfied or not applicable) (section 10, The document and its data)",
      "documentText": "{\"openbindings\":\"0.2.0\",\"operations\":{\"a\":{}},\"operations\":{\"b\":{}},\"dependencies\":{\"d\":{\"operation\":\"a\"}}}",
      "valid": false,
      "violates": [
        "OBI-D-01"
      ],
      "notViolated": [
        "OBI-D-02",
        "OBI-D-03",
        "OBI-D-04",
        "OBI-D-05",
        "OBI-D-06",
        "OBI-D-07",
        "OBI-D-08",
        "OBI-D-09",
        "OBI-D-10",
        "OBI-D-11",
        "OBI-D-12",
        "OBI-D-13"
      ]
    },
    {
      "description": "a NaN literal is not a JSON value (RFC 8259 section 6), so the text is malformed JSON",
      "documentText": "{\"openbindings\":\"0.2.0\",\"operations\":{},\"x-a\":NaN}",
      "valid": false,
      "violates": [
        "OBI-D-01"
      ],
      "notViolated": [
        "OBI-D-02",
        "OBI-D-03",
        "OBI-D-04",
        "OBI-D-05",
        "OBI-D-06",
        "OBI-D-07",
        "OBI-D-08",
        "OBI-D-09",
        "OBI-D-10",
        "OBI-D-11",
        "OBI-D-12",
        "OBI-D-13"
      ]
    },
    {
      "description": "a comma after the last member of an object is malformed JSON (RFC 8259 section 4)",
      "documentText": "{\"openbindings\":\"0.2.0\",\"operations\":{},}",
      "valid": false,
      "violates": [
        "OBI-D-01"
      ],
      "notViolated": [
        "OBI-D-02",
        "OBI-D-03",
        "OBI-D-04",
        "OBI-D-05",
        "OBI-D-06",
        "OBI-D-07",
        "OBI-D-08",
        "OBI-D-09",
        "OBI-D-10",
        "OBI-D-11",
        "OBI-D-12",
        "OBI-D-13"
      ]
    },
    {
      "description": "a key written with an escape repeats the same key written plainly: member names are compared after unescaping (RFC 8259 section 8.3, section 10)",
      "documentText": "{\"openbindings\":\"0.2.0\",\"operations\":{\"a\":{},\"\\u0061\":{}}}",
      "valid": false,
      "violates": [
        "OBI-D-01"
      ],
      "notViolated": [
        "OBI-D-02",
        "OBI-D-03",
        "OBI-D-04",
        "OBI-D-05",
        "OBI-D-06",
        "OBI-D-07",
        "OBI-D-08",
        "OBI-D-09",
        "OBI-D-10",
        "OBI-D-11",
        "OBI-D-12",
        "OBI-D-13"
      ]
    }
  ]
}
