{
  "rule": "OBI-D-06",
  "section": "10.2",
  "description": "Has every $schema in a schema the document contains equal to https://json-schema.org/draft/2020-12/schema. A $schema member of an example value or of a source's or binding's content is data, not a schema keyword.",
  "tests": [
    {
      "description": "schema with explicit 2020-12 $schema",
      "document": {
        "openbindings": "0.2.0",
        "schemas": {
          "Task": {
            "$id": "https://example.com/task.schema.json",
            "$schema": "https://json-schema.org/draft/2020-12/schema",
            "type": "object"
          }
        },
        "operations": { "createTask": {} }
      },
      "valid": true
    },
    {
      "description": "schema without $schema (omission permitted)",
      "document": {
        "openbindings": "0.2.0",
        "schemas": { "Task": { "type": "object" } },
        "operations": { "createTask": {} }
      },
      "valid": true
    },
    {
      "description": "schema with 2019-09 $schema value",
      "document": {
        "openbindings": "0.2.0",
        "schemas": {
          "Task": {
            "$id": "https://example.com/task.schema.json",
            "$schema": "https://json-schema.org/draft/2019-09/schema",
            "type": "object"
          }
        },
        "operations": { "createTask": {} }
      },
      "valid": false,
      "violates": ["OBI-D-06"]
    },
    {
      "description": "schema with draft-07 $schema value",
      "document": {
        "openbindings": "0.2.0",
        "schemas": {
          "Task": {
            "$id": "https://example.com/task.schema.json",
            "$schema": "http://json-schema.org/draft-07/schema#",
            "type": "object"
          }
        },
        "operations": { "createTask": {} }
      },
      "valid": false,
      "violates": ["OBI-D-06"]
    },
    {
      "description": "operation input schema with wrong $schema",
      "document": {
        "openbindings": "0.2.0",
        "operations": {
          "createTask": {
            "input": {
              "$id": "https://example.com/create-task.schema.json",
              "$schema": "https://json-schema.org/draft/2019-09/schema",
              "type": "object"
            }
          }
        }
      },
      "valid": false,
      "violates": ["OBI-D-06"]
    },
    {
      "description": "a $schema member inside an example value or a source's content is data, not a schema keyword",
      "document": {
        "openbindings": "0.2.0",
        "operations": {
          "lint": {
            "input": {
              "type": "object"
            },
            "examples": {
              "e": {
                "input": {
                  "$schema": "http://json-schema.org/draft-07/schema#"
                }
              }
            }
          }
        },
        "sources": {
          "s": {
            "kind": "example.test@1",
            "content": {
              "$schema": "http://json-schema.org/draft-07/schema#"
            }
          }
        }
      },
      "valid": true
    },
    {
      "description": "a wrong $schema on a nested schema that declares $id",
      "document": {
        "openbindings": "0.2.0",
        "schemas": {
          "Task": {
            "type": "object",
            "$defs": {
              "Inner": {
                "$id": "https://example.com/inner.schema.json",
                "$schema": "http://json-schema.org/draft-07/schema#",
                "type": "string"
              }
            }
          }
        },
        "operations": {
          "createTask": {}
        }
      },
      "valid": false,
      "violates": [
        "OBI-D-06"
      ]
    }
  ]
}
