{
  "rule": "OBI-T-03",
  "section": "10.3",
  "description": "A processor treats fields whose names begin with x- as extensions, and an x- field changes the meaning of no core field.",
  "notes": "These validity fixtures exercise OBI-T-03/c1 for validators: a document carrying x- members is judged as the same document without them, so it stays conformant. OBI-T-03/c2 (no x- field changes a core field's meaning) is exercised by the scenarios in scenarios/OBI-T-03.json, which observe resolution, the version decision, value validation, and kind comparison.",
  "tests": [
    {
      "description": "document with x- extension at the root level",
      "document": {
        "openbindings": "0.2.0",
        "x-vendor-metadata": {
          "owner": "platform-team",
          "tags": [
            "internal"
          ]
        },
        "operations": {
          "createTask": {}
        }
      },
      "valid": true,
      "clauses": [
        "OBI-T-03/c1"
      ]
    },
    {
      "description": "document with x- extensions on operation, binding, and source",
      "document": {
        "openbindings": "0.2.0",
        "operations": {
          "createTask": {
            "x-rate-limit-per-minute": 100
          }
        },
        "sources": {
          "httpApi": {
            "kind": "example.openapi@1",
            "x-cache-ttl-seconds": 300
          }
        },
        "bindings": {
          "createTask.http": {
            "operation": "createTask",
            "source": "httpApi",
            "x-retry-policy": "exponential"
          }
        }
      },
      "valid": true,
      "clauses": [
        "OBI-T-03/c1"
      ]
    },
    {
      "description": "an x- member named like a core field (x-operations) is an extension, so the document stays conformant",
      "document": {
        "openbindings": "0.2.0",
        "operations": {
          "createTask": {}
        },
        "x-operations": {
          "spurious": "should be ignored as extension, not interpreted as the operations map"
        }
      },
      "valid": true,
      "clauses": [
        "OBI-T-03/c1"
      ]
    },
    {
      "description": "x- extension nested deeply inside an operation",
      "document": {
        "openbindings": "0.2.0",
        "operations": {
          "createTask": {
            "input": {
              "type": "object"
            },
            "examples": {
              "happy": {
                "x-source": "production-traffic-sample",
                "input": {}
              }
            }
          }
        }
      },
      "valid": true,
      "clauses": [
        "OBI-T-03/c1"
      ]
    },
    {
      "description": "a member beginning X- is not an extension: names compare exactly, so it is an unknown field",
      "document": {
        "openbindings": "0.2.0",
        "operations": {
          "f": {
            "X-note": "uppercase prefix"
          }
        }
      },
      "valid": false,
      "violates": [
        "OBI-D-02"
      ],
      "clauses": [
        "OBI-T-03/c1"
      ]
    }
  ]
}
