{
  "rule": "OBI-08",
  "section": "10",
  "description": "Has every dependencies[*].operation value present as a key in the document's operations map.",
  "tests": [
    {
      "description": "dependency references an existing operation key with no kinds constraint",
      "document": {
        "openbindings": "0.2.0",
        "operations": {
          "deliverEvent": {}
        },
        "dependencies": {
          "delivery": {
            "operation": "deliverEvent"
          }
        }
      },
      "valid": true
    },
    {
      "description": "multiple named dependencies reference the same operation with different kinds constraints",
      "document": {
        "openbindings": "0.2.0",
        "operations": {
          "deliverEvent": {}
        },
        "dependencies": {
          "customerDelivery": {
            "operation": "deliverEvent",
            "kinds": [
              "example.openapi@1"
            ]
          },
          "internalDelivery": {
            "operation": "deliverEvent",
            "kinds": [
              "example.grpc@1"
            ]
          }
        }
      },
      "valid": true
    },
    {
      "description": "the same operation is both realized by a binding and consumed through a dependency",
      "document": {
        "openbindings": "0.2.0",
        "operations": {
          "deliverEvent": {}
        },
        "sources": {
          "local": {
            "kind": "example.delivery@1"
          }
        },
        "bindings": {
          "deliverEvent.local": {
            "operation": "deliverEvent",
            "source": "local"
          }
        },
        "dependencies": {
          "forwardDelivery": {
            "operation": "deliverEvent"
          }
        }
      },
      "valid": true
    },
    {
      "description": "dependency references a non-existent operation key",
      "document": {
        "openbindings": "0.2.0",
        "operations": {
          "deliverEvent": {}
        },
        "dependencies": {
          "delivery": {
            "operation": "missingOperation"
          }
        }
      },
      "valid": false,
      "violates": [
        "OBI-08"
      ]
    },
    {
      "description": "dependency operation value matches an alias rather than a key in the operations map",
      "document": {
        "openbindings": "0.2.0",
        "operations": {
          "deliverEvent": {
            "aliases": [
              "events.deliver"
            ]
          }
        },
        "dependencies": {
          "delivery": {
            "operation": "events.deliver"
          }
        }
      },
      "valid": false,
      "violates": [
        "OBI-08"
      ]
    },
    {
      "description": "dependency references operation constructor, a valid identifier and built-in object property name, with no such operation defined",
      "document": {
        "openbindings": "0.2.0",
        "operations": {
          "deliverEvent": {}
        },
        "dependencies": {
          "delivery": {
            "operation": "constructor"
          }
        }
      },
      "valid": false,
      "violates": [
        "OBI-08"
      ]
    },
    {
      "description": "document may genuinely define and depend on an operation named constructor",
      "document": {
        "openbindings": "0.2.0",
        "operations": {
          "constructor": {}
        },
        "dependencies": {
          "delivery": {
            "operation": "constructor"
          }
        }
      },
      "valid": true
    },
    {
      "description": "dependency references operation createtask, which differs from the operation key createTask only in case",
      "document": {
        "openbindings": "0.2.0",
        "operations": {
          "createTask": {}
        },
        "dependencies": {
          "tasks": {
            "operation": "createtask"
          }
        }
      },
      "valid": false,
      "violates": [
        "OBI-08"
      ]
    }
  ]
}
