{
  "rule": "OBI-T-10",
  "section": "10.3",
  "description": "A seemingly inaccurate author-attested `idempotent` claim is not a core document defect; truth of the claim is outside document conformance.",
  "notes": "All tests are positive (valid: true). Operation names tempt plausibility heuristics, but such heuristics cannot establish a document-rule violation. Tools remain free to use the claim in their own decisions.",
  "tests": [
    {
      "description": "write-shaped operation claims idempotent: true — plausibility cannot determine document validity",
      "document": {
        "openbindings": "0.2.0",
        "operations": { "createTask": { "idempotent": true } }
      },
      "valid": true
    },
    {
      "description": "read-shaped operation claims idempotent: false — apparent inaccuracy in the other direction",
      "document": {
        "openbindings": "0.2.0",
        "operations": { "listTasks": { "idempotent": false } }
      },
      "valid": true
    },
    {
      "description": "mass-delete name claims idempotent: true — bait for a method-name heuristic, though §5.1 itself notes repeated deletion can be idempotent; either way the attestation stands",
      "document": {
        "openbindings": "0.2.0",
        "operations": { "deleteAllRecords": { "idempotent": true } }
      },
      "valid": true
    }
  ]
}
